{
  "schema_version": 1,
  "generated_at": "2026-08-08T12:05:39.845464+00:00",
  "producer": "write_artifact_manifest.py",
  "trace_id": null,
  "artifacts": {
    "advocate_context.md": {
      "sha256": "b38be59dfe1d18de35d5c397bbb5d6ef42e56721002a6071d592663594f22f8e",
      "bytes": 33170
    },
    "article_spec.md": {
      "sha256": "0d652c9b10a4923d3dcbbdaeea7d448177fcb94d8fce647cf220c5fa13520342",
      "bytes": 8992
    },
    "claims_for_drafting.md": {
      "sha256": "0131fc721e6f667ab8c5f24f4ad102e768d03f6e822d6e31945aeb4064846bd7",
      "bytes": 19056
    },
    "conflict_decisions.json": {
      "sha256": "a785a6d1df5c5527025c39fae969f84d0c14d7ed4495e538d62655a75c07c5f2",
      "bytes": 1237
    },
    "conflict_register.md": {
      "sha256": "d4169c75c991151a7ca5532d7e4e49c655d237471f8edff4e4e118e1e8e8f99f",
      "bytes": 4164
    },
    "fact_check_report.md": {
      "sha256": "34aa2f0574335f7418db5ee39f1463b448e517e08a3d4c38efb067d7b2212290",
      "bytes": 9679
    },
    "pipeline_config.json": {
      "sha256": "2d1ebf74796fed4dc64a035b4fbfd219982cce3310ab25f567da47356ff67076",
      "bytes": 2454
    },
    "pipeline_learnings.md": {
      "sha256": "6b8680338557eebddb70d26fb9411d9449104c256792ffa67710475c673f248d",
      "bytes": 2688
    },
    "pipeline_state.json": {
      "sha256": "4bfbb71fd5ec07caa3f72c2911b4795b0da41d581377318b2ba6122e3e9c0540",
      "bytes": 558
    },
    "research_context.md": {
      "sha256": "95cfc12e99bb2fe088ea3665095969cb36a96c1a93ce166d2f95825995e389dd",
      "bytes": 16004
    },
    "research_context_summary.md": {
      "sha256": "9a20c391bd23f53a42786b2c9d488ccf2a9fac9f9bfee55b203687fa633f3f9a",
      "bytes": 5516
    },
    "skeptic_evidence.md": {
      "sha256": "60574167a28a7faab47ebcce4cdb0cc1b4e7f27875f13fba70a13aa74ceafe65",
      "bytes": 24527
    }
  }
}
